"","title","author","journal","number","cites","year","cid","pubid"
"1","Object-based assessment of burn severity in diseased forests using high-spatial and high-spectral resolution MASTER airborne imagery","G Chen, MR Metz, DM Rizzo, WW Dillon, RK Meentemeyer","ISPRS journal of photogrammetry and remote sensing","102, 38-47",13,2015,"13799939590325896049","d1gkVwhDpl0C"
"2","Biodiversity conservation in the face of dramatic forest disease: an integrated conservation strategy for tanoak (Notholithocarpus densiflorus) threatened by sudden oak death","RC Cobb, DM Rizzo, KJ Hayden, M Garbelotto, JAN Filipe, CA Gilligan, ...","Madroño","60 (2), 151-165",13,2013,"7960168869093296487","u5HHmVD_uO8C"
"3","California forests show early indications of both range shifts and local persistence under climate change","JM Serra‐Diaz, J Franklin, WW Dillon, AD Syphard, FW Davis, ...","Global ecology and biogeography","25 (2), 164-175",12,2016,"4249103328361430814","u-x6o8ySG0sC"
"4","Effects of individual, community and landscape drivers on the dynamics of a wildland forest epidemic","SE Haas, JH Cushman, WW Dillon, NE Rank, DM Rizzo, ...","Ecology","",11,2016,"16268725277050663431","2osOgNQ5qMEC"
"5","Perspectives of spatial scale in a wildland forest epidemic","WW Dillon, SE Haas, DM Rizzo, RK Meentemeyer","European journal of plant pathology","138 (3), 449-465",6,2014,"3967349617077249341","9yKSN-GCB0IC"
"6","Spatio-temporal reconstruction of missing forest microclimate measurements","F Tonini, WW Dillon, ES Money, RK Meentemeyer","Agricultural and forest meteorology","218, 1-10",5,2016,"1399046645337347009","UeHWp8X0CEIC"
"7","Range-wide threats to a foundation tree species from disturbance interactions","WW Dillon, RK Meentemeyer, JB Vogler, RC Cobb, MR Metz, DM Rizzo","Madroño","60 (2), 139-151",5,2013,"8047187520745679643","qjMakFHDy7sC"
"8","Effects of Diversity, Topography, and Interannual Climate Variability on Pathogen Spillover","WW Dillon, RK Meentemeyer, DM Rizzo","Sudden Oak Death Sixth Science Symposium","8",0,2017,NA,"IjCSPb-OGe4C"
